title,paiming,uri,lat,lng,recommend_price,hotel_address,hotel_star,hotel_city,hotel_section,price_range,avg_rating,comment_count,offical_img_uri,facility,room,agoda_price
兆品酒店嘉義,嘉義排名第 1 的超值住宿地點，共 122 家,https://www.tripadvisor.com.tw/Hotel_Review-g13808399-d308696-Reviews-Maison_de_Chine_Hotel_Chiayi-West_District_Chiayi.html,23.483396530151367,120.44874572753906,"NT$1,819",文化路257號,3.5,嘉義,西區,"NT$1,854 - NT$3,613",5.0,1970,https://media-cdn.tripadvisor.com/media/photo-s/0a/38/c9/5c/caption.jpg,"禁菸客房, 套房, 家庭房, 空調設施, 房務, 私人陽台, 迷你吧, 平板電視, 客房服務, 保險箱, 冰箱","免費停車, 免費高速上網 (WiFi), 有健身房的健身中心, 免費早餐, 兒童可享免費住宿, 兒童活動 (適合兒童/家庭), 免費機場接送, 提供上網服務的商務中心, 停車, 免費網際網路, 無線網路, 公用無線網路, 網際網路, 餐廳, 提供早餐, 自助式早餐, 免費接駁或計程車服務, 機場接送, 巴士接駁服務, 會議設施, 宴會廳, 會議室, 禮賓服務, 禁菸飯店, 24 小時服務櫃台, 乾洗服務, 洗衣服務, 自助式洗衣",
福泰桔子商旅 嘉義文化店,嘉義排名第 2 的超值住宿地點，共 122 家,https://www.tripadvisor.com.tw/Hotel_Review-g13806498-d11998083-Reviews-Orange_Hotel_Wenhua_Chiayi-East_District_Chiayi.html,23.4810848236084,120.44937896728516,NT$694,文化路169號,3.5,嘉義,東區,"NT$786 - NT$2,828",5.0,2566,https://media-cdn.tripadvisor.com/media/photo-s/13/10/24/32/photo0jpg.jpg,"禁菸客房, 套房, 家庭房, 空調設施, 保險箱, 冰箱, 平板電視","免費停車, 免費高速上網 (WiFi), 免費網際網路, 免費早餐, 兒童活動 (適合兒童/家庭), 禁菸飯店, 乾洗服務, 洗衣服務, 無線網路, 公用無線網路, 網際網路, 餐廳, 提供早餐, 自助式早餐, 自助式洗衣","NT$1,693"
承億文旅-桃城茶樣子,嘉義排名第 3 的超值住宿地點，共 122 家,https://www.tripadvisor.com.tw/Hotel_Review-g13806498-d6767724-Reviews-Hotel_Day_Plus_Teascape-East_District_Chiayi.html,23.493654251098633,120.45281219482422,"NT$2,481",東區忠孝路516號,4.0,嘉義,東區,"NT$2,545 - NT$5,216",4.5,428,https://media-cdn.tripadvisor.com/media/photo-s/0e/cb/6d/b9/photo4jpg.jpg,"禁菸客房, 套房, 家庭房, 空調設施, 房務, 迷你吧, 冰箱, 平板電視","免費停車, 免費高速上網 (WiFi), 游泳池, 有健身房的健身中心, 免費早餐, 兒童活動 (適合兒童/家庭), 巴士接駁服務, 會議設施, 免費網際網路, 無線網路, 公用無線網路, 網際網路, 屋頂游泳池, 室外游泳池, 酒吧/酒廊, 餐廳, 提供早餐, 自助式早餐, 游泳池酒吧, 屋頂酒吧, 會議室, 屋頂露台, 禮賓服務, 禁菸飯店, 洗衣服務","NT$3,463"
嘉義商旅,嘉義排名第 4 的超值住宿地點，共 122 家,https://www.tripadvisor.com.tw/Hotel_Review-g13808399-d2144929-Reviews-Hotel_Day_Plus_Chiayi-West_District_Chiayi.html,23.473146438598633,120.43753051757812,"NT$1,342",垂楊路866號,3.5,嘉義,西區,"NT$1,320 - NT$3,362",4.5,641,https://media-cdn.tripadvisor.com/media/photo-s/01/e5/9f/5c/room.jpg,"禁菸客房, 套房, 家庭房, 空調設施, 冰箱, 平板電視","免費停車, 免費高速上網 (WiFi), 免費早餐, 兒童活動 (適合兒童/家庭), 巴士接駁服務, 提供上網服務的商務中心, 會議室, 禁菸飯店, 免費網際網路, 無線網路, 公用無線網路, 網際網路, 餐廳, 自助式早餐, 乾洗服務, 洗衣服務, 自助式洗衣",
天成文旅-繪日之丘,嘉義排名第 5 的超值住宿地點，共 122 家,https://www.tripadvisor.com.tw/Hotel_Review-g13806498-d10593117-Reviews-Sun_Dialogue_Hotel-East_District_Chiayi.html,23.48027229309082,120.48335266113281,"NT$1,737",大雅路一段888號 嘉义市,3.5,嘉義,東區,"NT$2,011 - NT$4,305",5.0,2475,https://media-cdn.tripadvisor.com/media/photo-s/0c/37/0e/4c/caption.jpg,"禁菸客房, 套房, 家庭房, 空調設施","免費停車, 免費高速上網 (WiFi), 免費網際網路, 免費早餐, 餐廳, 兒童活動 (適合兒童/家庭), 禮賓服務, 禁菸飯店, 無線網路, 網際網路, 自助式早餐","NT$2,337"
寬悅花園酒店,嘉義排名第 6 的超值住宿地點，共 122 家,https://www.tripadvisor.com.tw/Hotel_Review-g13806498-d14162885-Reviews-Kuan_Hotel-East_District_Chiayi.html,23.50487518310547,120.44995880126953,"NT$2,500",保順路69號,4.0,嘉義,東區,"NT$2,357 - NT$3,582",5.0,72,https://media-cdn.tripadvisor.com/media/photo-s/15/5b/5a/34/caption.jpg,"禁菸客房, 套房, 家庭房, 空調設施, 冰箱","免費停車, 免費高速上網 (WiFi), 有健身房的健身中心, 酒吧/酒廊, 兒童活動 (適合兒童/家庭), 允許攜帶寵物 (可帶狗/寵物), 巴士接駁服務, 提供上網服務的商務中心, 免費網際網路, 無線網路, 公用無線網路, 網際網路, 餐廳, 提供早餐, 會議設施, 宴會廳, 會議室, 禮賓服務, 禁菸飯店, 自助式洗衣",
嘉義亮點旅店,嘉義排名第 7 的超值住宿地點，共 122 家,https://www.tripadvisor.com.tw/Hotel_Review-g13808399-d11651303-Reviews-Hotel_Discover-West_District_Chiayi.html,23.4255313873291,120.53753662109375,"NT$1,596",仁愛路560號,3.5,嘉義,西區,"NT$1,697 - NT$2,859",4.5,106,https://media-cdn.tripadvisor.com/media/photo-s/0f/2c/3c/83/hotel-discover.jpg,"禁菸客房, 套房, 空調設施, 客房服務","免費高速上網 (WiFi), 免費網際網路, 無線網路, 網際網路, 有健身房的健身中心, 餐廳, 洗衣服務",
安蘭居國際青年館,嘉義排名第 8 的超值住宿地點，共 122 家,https://www.tripadvisor.com.tw/Hotel_Review-g13808399-d4474640-Reviews-An_Lan_Jie_Hostel-West_District_Chiayi.html,23.47663116455078,120.4416275024414,"NT$1,098",蘭井街465號14樓之一,2.0,嘉義,西區,"NT$1,257 - NT$2,734",5.0,95,https://media-cdn.tripadvisor.com/media/photo-s/11/4b/6d/c3/standard-double-room.jpg,"禁菸客房, 套房, 家庭房, 空調設施, 小廚房","免費高速上網 (WiFi), 免費網際網路, 免費早餐, 提供早餐, 會議設施, 會議室, 禁菸飯店, 自助式洗衣, 無線網路, 公用無線網路, 網際網路","NT$1,914"
嘉義樂客商務旅館,嘉義排名第 9 的超值住宿地點，共 122 家,https://www.tripadvisor.com.tw/Hotel_Review-g13808399-d6557476-Reviews-Look_Hotel_Chiayi-West_District_Chiayi.html,23.483991622924805,120.4478759765625,"NT$1,855",東區林森西路155號,3.5,嘉義,西區,"NT$1,131 - NT$2,891",4.0,46,https://media-cdn.tripadvisor.com/media/photo-s/0c/e8/52/98/caption.jpg,免費網際網路,,
尊皇大飯店,嘉義排名第 10 的超值住宿地點，共 122 家,https://www.tripadvisor.com.tw/Hotel_Review-g13808399-d7226996-Reviews-Tsun_Huang_Hotel-West_District_Chiayi.html,23.47382354736328,120.4217758178711,"NT$1,661",西區大華路250號,4.0,嘉義,西區,"NT$1,697 - NT$3,299",4.0,78,https://media-cdn.tripadvisor.com/media/photo-s/0e/d4/d9/0a/caption.jpg,"禁菸客房, 家庭房, 空調設施, 客房服務, 平板電視","免費停車, 免費高速上網 (WiFi), 游泳池, 有健身房的健身中心, 酒吧/酒廊, 巴士接駁服務, 提供上網服務的商務中心, 宴會廳, 免費網際網路, 無線網路, 公用無線網路, 網際網路, 餐廳, 提供早餐, 自助式早餐, 會議室, 禮賓服務, 禁菸飯店",
皇爵大飯店,嘉義排名第 11 的超值住宿地點，共 122 家,https://www.tripadvisor.com.tw/Hotel_Review-g13808399-d584028-Reviews-Chiayi_King_Hotel-West_District_Chiayi.html,23.480005264282227,120.44412994384766,"NT$1,110",新榮路234號,3.5,嘉義,西區,"NT$1,163 - NT$2,199",4.0,104,https://media-cdn.tripadvisor.com/media/photo-s/10/47/b2/21/caption.jpg,"禁菸客房, 家庭房, 空調設施, 冰箱, 平板電視","免費停車, 免費高速上網 (WiFi), 免費早餐, 提供上網服務的商務中心, 會議設施, 禮賓服務, 禁菸飯店, 乾洗服務, 免費網際網路, 無線網路, 公用無線網路, 網際網路, 餐廳, 提供早餐, 自助式早餐, 會議室, 自助式洗衣",
嘉楠風華酒店,嘉義排名第 12 的超值住宿地點，共 122 家,https://www.tripadvisor.com.tw/Hotel_Review-g13808399-d12259955-Reviews-Orient_Luxury_Hotel-West_District_Chiayi.html,23.48256492614746,120.42742156982422,"NT$1,519",西區四維路232號,3.5,嘉義,西區,"NT$1,728 - NT$3,771",3.5,27,https://media-cdn.tripadvisor.com/media/photo-s/11/a0/6b/b1/caption.jpg,,,
Hotel Hi 新民店,嘉義排名第 13 的超值住宿地點，共 122 家,https://www.tripadvisor.com.tw/Hotel_Review-g13808399-d4406586-Reviews-Hotel_Hi_Xinmin-West_District_Chiayi.html,23.469938278198242,120.44043731689453,"NT$1,230",西區新民路784-1號,3.5,嘉義,西區,"NT$1,383 - NT$3,205",3.5,66,https://media-cdn.tripadvisor.com/media/photo-s/07/af/cf/5b/hotel-hi.jpg,"禁菸客房, 套房, 家庭房, 空調設施, 客房服務, 冰箱","免費停車, 免費高速上網 (WiFi), 免費網際網路, 提供早餐, 自助式早餐, 兒童活動 (適合兒童/家庭), 巴士接駁服務, 禁菸飯店, 無線網路, 公用無線網路, 網際網路",
嘉義皇品國際酒店,嘉義排名第 14 的超值住宿地點，共 122 家,https://www.tripadvisor.com.tw/Hotel_Review-g13808399-d6615165-Reviews-Royal_Chiayi_Hotel-West_District_Chiayi.html,23.492572784423828,120.43244934082031,"NT$1,744",自由路468號,4.0,嘉義,西區,"NT$2,105 - NT$5,184",4.0,103,https://media-cdn.tripadvisor.com/media/photo-s/13/bd/e7/ac/caption.jpg,"禁菸客房, 套房, 家庭房, 空調設施, 客房服務, 冰箱","免費停車, 免費高速上網 (WiFi), 有健身房的健身中心, 免費早餐, 提供上網服務的商務中心, 會議設施, 禁菸飯店, 洗衣服務, 免費網際網路, 無線網路, 網際網路, 酒吧/酒廊, 餐廳, 提供早餐, 宴會廳, 會議室, 自助式洗衣","NT$1,948"
蘭桂坊花園酒店 - 嘉義,嘉義排名第 15 的超值住宿地點，共 122 家,https://www.tripadvisor.com.tw/Hotel_Review-g13808399-d8872689-Reviews-Lan_Kwai_Fong_Garden_Hotel_Chiayi-West_District_Chiayi.html,23.47684669494629,120.44966125488281,"NT$1,548",西區延平街250號,3.5,嘉義,西區,"NT$1,414 - NT$3,613",4.5,49,https://media-cdn.tripadvisor.com/media/photo-s/0e/90/a5/e6/caption.jpg,"禁菸客房, 套房, 家庭房, 空調設施, 客房服務, 冰箱","免費高速上網 (WiFi), 免費網際網路, 無線網路, 免費早餐, 提供早餐, 會議室, 禁菸飯店, 洗衣服務, 公用無線網路, 網際網路",
耐斯王子飯店,嘉義排名第 16 的超值住宿地點，共 122 家,https://www.tripadvisor.com.tw/Hotel_Review-g13806498-d617452-Reviews-Nice_Prince_Hotel-East_District_Chiayi.html,23.496671676635742,120.45335388183594,"NT$2,273",東區忠孝路600號,4.0,嘉義,東區,"NT$2,700 - NT$3,928",4.0,146,https://media-cdn.tripadvisor.com/media/photo-s/12/3d/d4/9c/caption.jpg,"禁菸客房, 家庭房, 空調設施, 客房服務","免費停車, 免費高速上網 (WiFi), 有健身房的健身中心, 免費早餐, 提供上網服務的商務中心, Spa, 禁菸飯店, 乾洗服務, 免費網際網路, 無線網路, 網際網路, 酒吧/酒廊, 餐廳, 自助式早餐, 洗衣服務",
新高大飯店,嘉義排名第 17 的超值住宿地點，共 122 家,https://www.tripadvisor.com.tw/Hotel_Review-g13808399-d2241487-Reviews-Shin_Kao_Hotel-West_District_Chiayi.html,23.479169845581055,120.44246673583984,NT$653,中山路581號,,嘉義,西區,"NT$723 - NT$1,100",3.5,52,https://media-cdn.tripadvisor.com/media/photo-s/08/c8/d3/da/caption.jpg,"套房, 家庭房, 空調設施","免費高速上網 (WiFi), 免費網際網路, 無線網路, 公用無線網路, 網際網路, 禁菸飯店, 洗衣服務",
德爾芙快捷酒店,嘉義排名第 18 的超值住宿地點，共 122 家,https://www.tripadvisor.com.tw/Hotel_Review-g13808399-d7649854-Reviews-De_Reve_Express_Hotel-West_District_Chiayi.html,23.47539710998535,120.44210052490234,"NT$1,108",西區仁愛路361號5-11樓,3.0,嘉義,西區,"NT$1,068 - NT$3,111",3.5,37,https://media-cdn.tripadvisor.com/media/photo-s/11/7a/1f/bd/caption.jpg,"禁菸客房, 套房, 家庭房, 空調設施, 冰箱, 平板電視","免費停車, 免費高速上網 (WiFi), 酒吧/酒廊, 提供上網服務的商務中心, 會議設施, 禮賓服務, 禁菸飯店, 自助式洗衣, 免費網際網路, 無線網路, 公用無線網路, 網際網路, 餐廳, 提供早餐, 會議室",
里亞行旅,嘉義排名第 19 的超值住宿地點，共 122 家,https://www.tripadvisor.com.tw/Hotel_Review-g13808399-d9809645-Reviews-Hotel_Liyaou-West_District_Chiayi.html,23.475875854492188,120.44025421142578,"NT$2,164",永和街100號,3.5,嘉義,西區,"NT$2,482 - NT$3,739",4.5,183,https://media-cdn.tripadvisor.com/media/photo-s/12/d7/89/df/caption.jpg,"禁菸客房, 套房, 家庭房, 空調設施, 冰箱","免費高速上網 (WiFi), 免費早餐, 兒童活動 (適合兒童/家庭), 提供上網服務的商務中心, 會議室, 禮賓服務, 禁菸飯店, 自助式洗衣, 免費網際網路, 無線網路, 公用無線網路, 網際網路, 餐廳, 提供早餐",
日出行旅,嘉義排名第 20 的超值住宿地點，共 122 家,https://www.tripadvisor.com.tw/Hotel_Review-g13808399-d11875764-Reviews-Sun_Rise_Hotel_Chiayi-West_District_Chiayi.html,23.474889755249023,120.44209289550781,"NT$1,211",西區仁愛路347號2樓之2,3.5,嘉義,西區,"NT$1,414 - NT$2,859",4.0,29,https://media-cdn.tripadvisor.com/media/photo-s/0e/b8/c2/16/caption.jpg,"禁菸客房, 套房, 家庭房, 空調設施, 客房服務, 冰箱","免費高速上網 (WiFi), 免費網際網路, 無線網路, 公用無線網路, 免費早餐, 餐廳, 禮賓服務, 禁菸飯店, 網際網路",
萬泰大飯店,嘉義排名第 21 的超值住宿地點，共 122 家,https://www.tripadvisor.com.tw/Hotel_Review-g13808399-d1419921-Reviews-Wan_Tai_Hotel-West_District_Chiayi.html,23.473669052124023,120.44486236572266,NT$904,新榮路46號,,嘉義,西區,"NT$1,037 - NT$2,388",4.0,18,https://media-cdn.tripadvisor.com/media/photo-s/0c/f3/54/fa/restaurant.jpg,"禁菸客房, 家庭房, 空調設施, 客房服務, 冰箱","免費停車, 免費高速上網 (WiFi), 免費早餐, 機場接送, 提供上網服務的商務中心, 禮賓服務, 禁菸飯店, 乾洗服務, 免費網際網路, 無線網路, 網際網路, 餐廳, 巴士接駁服務, 洗衣服務",
承億輕旅嘉義館,嘉義排名第 22 的超值住宿地點，共 122 家,https://www.tripadvisor.com.tw/Hotel_Review-g13808399-d7598689-Reviews-Light_Hostel_Chiayi-West_District_Chiayi.html,23.477834701538086,120.44406127929688,NT$969,光彩街622號,2.0,嘉義,西區,"NT$943 - NT$1,508",4.5,177,https://media-cdn.tripadvisor.com/media/photo-s/07/5a/8c/ed/caption.jpg,"禁菸客房, 套房, 空調設施, 小廚房","免費高速上網 (WiFi), 免費網際網路, 無線網路, 網際網路, 免費早餐, 提供上網服務的商務中心, 禁菸飯店",
南院旅墅,嘉義排名第 23 的超值住宿地點，共 122 家,https://www.tripadvisor.com.tw/Hotel_Review-g13806498-d10826191-Reviews-South_Urban_Hotel-East_District_Chiayi.html,23.480300903320312,120.45867156982422,"NT$1,964",東區公明路65號 东区,4.0,嘉義,東區,"NT$2,262 - NT$3,519",4.0,30,https://media-cdn.tripadvisor.com/media/photo-s/0e/2f/f5/1f/caption.jpg,"禁菸客房, 套房","免費停車, 免費高速上網 (WiFi), 免費網際網路, 游泳池, 有健身房的健身中心, 免費早餐, 提供上網服務的商務中心, 禁菸飯店, 無線網路, 公用無線網路, 網際網路, 酒吧/酒廊, 餐廳",
嘉義小青旅,嘉義排名第 24 的超值住宿地點，共 122 家,https://www.tripadvisor.com.tw/Hotel_Review-g13808399-d8354273-Reviews-Petite_Hostel-West_District_Chiayi.html,23.48113441467285,120.44376373291016,"NT$1,126",西區番社里林森西路460號,2.0,嘉義,西區,"NT$503 - NT$1,477",5.0,17,https://media-cdn.tripadvisor.com/media/photo-s/12/cc/77/97/caption.jpg,"禁菸客房, 小廚房","免費停車, 免費高速上網 (WiFi), 免費網際網路, 無線網路, 公用無線網路, 網際網路, 禁菸飯店, 自助式洗衣",
嘉義行藝文旅,嘉義排名第 25 的超值住宿地點，共 122 家,https://www.tripadvisor.com.tw/Hotel_Review-g13808399-d8872810-Reviews-Travel_Art_Inn-West_District_Chiayi.html,23.4747371673584,120.44216918945312,"NT$1,156",仁愛路345號,3.0,嘉義,西區,"NT$1,257 - NT$2,954",4.5,36,https://media-cdn.tripadvisor.com/media/photo-s/0a/68/fa/30/caption.jpg,"禁菸客房, 套房, 家庭房, 空調設施, 迷你吧, 冰箱","免費高速上網 (WiFi), 免費網際網路, 無線網路, 公用無線網路, 免費早餐, 兒童活動 (適合兒童/家庭), 禮賓服務, 禁菸飯店, 網際網路","NT$1,361"
晨光飯店,嘉義排名第 26 的超值住宿地點，共 122 家,https://www.tripadvisor.com.tw/Hotel_Review-g13808399-d12419724-Reviews-ML_Hotel-West_District_Chiayi.html,23.47801399230957,120.44879150390625,"NT$1,641",西區光彩街389號,3.5,嘉義,西區,"NT$1,885 - NT$3,645",4.5,15,https://media-cdn.tripadvisor.com/media/photo-s/0f/53/88/3a/caption.jpg,"禁菸客房, 套房, 家庭房, 空調設施, 冰箱","免費停車, 免費高速上網 (WiFi), 免費網際網路, 無線網路, 餐廳, 提供早餐, 禮賓服務, 禁菸飯店, 公用無線網路, 網際網路",
冠閣大飯店,嘉義排名第 27 的超值住宿地點，共 122 家,https://www.tripadvisor.com.tw/Hotel_Review-g13808399-d4358645-Reviews-Guanko_Hotel-West_District_Chiayi.html,23.483728408813477,120.43419647216797,"NT$1,744",西區忠順一街27號,3.5,嘉義,西區,"NT$2,011 - NT$3,928",4.5,88,https://media-cdn.tripadvisor.com/media/photo-s/06/a9/4d/a8/caption.jpg,"禁菸客房, 套房, 家庭房, 空調設施, 迷你吧, 冰箱","免費停車, 免費高速上網 (WiFi), 酒吧/酒廊, 兒童活動 (適合兒童/家庭), 巴士接駁服務, 提供上網服務的商務中心, 會議設施, 禮賓服務, 免費網際網路, 無線網路, 公用無線網路, 網際網路, 餐廳, 會議室, 禁菸飯店, 自助式洗衣","NT$1,948"
嘉義觀止飯店,嘉義排名第 28 的超值住宿地點，共 122 家,https://www.tripadvisor.com.tw/Hotel_Review-g13808399-d7934155-Reviews-Chiayi_Guanzhi_Hotel-West_District_Chiayi.html,23.47927474975586,120.42912292480469,"NT$1,843",中興路467號,3.5,嘉義,西區,"NT$2,137 - NT$3,174",3.5,73,https://media-cdn.tripadvisor.com/media/photo-s/08/ca/aa/55/photo0jpg.jpg,禁菸客房,"免費網際網路, 禁菸飯店","NT$1,861"
嘉宮旅社,嘉義排名第 29 的超值住宿地點，共 122 家,https://www.tripadvisor.com.tw/Hotel_Review-g13808399-d12123689-Reviews-ChiaKon_Hotel-West_District_Chiayi.html,23.475290298461914,120.44451904296875,"NT$1,113",西區新榮路187號,3.0,嘉義,西區,"NT$1,163 - NT$2,388",4.5,5,https://media-cdn.tripadvisor.com/media/photo-s/13/be/6f/23/caption.jpg,"禁菸客房, 套房, 空調設施","免費高速上網 (WiFi), 免費網際網路, 無線網路, 公用無線網路, 網際網路, 免費早餐, 禁菸飯店",
書旅拾光,嘉義排名第 30 的超值住宿地點，共 122 家,https://www.tripadvisor.com.tw/Hotel_Review-g13808399-d12351957-Reviews-Bobooks-West_District_Chiayi.html,23.47863006591797,120.44468688964844,"NT$1,217",東區中正路597號,2.0,嘉義,西區,"NT$566 - NT$1,414",5.0,4,https://media-cdn.tripadvisor.com/media/photo-s/10/e5/9a/ea/imag1322-largejpg.jpg,小廚房,"免費高速上網 (WiFi), 免費網際網路, 無線網路, 網際網路",
Hotel Hi 垂楊店,嘉義排名第 31 的超值住宿地點，共 122 家,https://www.tripadvisor.com.tw/Hotel_Review-g13808399-d7223460-Reviews-HOTEL_HI_Chui_Yang_Branch-West_District_Chiayi.html,23.472867965698242,120.43798065185547,"NT$1,302",西區垂楊路860號,3.0,嘉義,西區,"NT$1,351 - NT$2,891",3.5,25,https://media-cdn.tripadvisor.com/media/photo-s/07/b3/35/73/hotel-hi.jpg,"禁菸客房, 套房, 空調設施, 冰箱","免費高速上網 (WiFi), 免費網際網路, 無線網路, 公用無線網路, 網際網路, 餐廳, 禁菸飯店",
夏禾國際行舘,嘉義排名第 32 的超值住宿地點，共 122 家,https://www.tripadvisor.com.tw/Hotel_Review-g13808399-d7003120-Reviews-Summer_Seedling_International_Villa-West_District_Chiayi.html,23.475055694580078,120.4271469116211,"NT$1,385",西區大華路50號,3.5,嘉義,西區,"NT$1,602 - NT$2,954",3.5,13,https://media-cdn.tripadvisor.com/media/photo-s/06/66/d4/ae/getlstd-property-photo.jpg,套房,"免費停車, 免費高速上網 (WiFi), 免費網際網路, 無線網路, 網際網路, 免費早餐, 餐廳, 巴士接駁服務","NT$1,385"
嘉冠大飯店,嘉義排名第 33 的超值住宿地點，共 122 家,https://www.tripadvisor.com.tw/Hotel_Review-g13808399-d1628329-Reviews-Chiayi_Crown_Hotel-West_District_Chiayi.html,23.478271484375,120.44322967529297,NT$753,西門街238-2號,3.0,嘉義,西區,"NT$786 - NT$1,822",3.0,14,https://media-cdn.tripadvisor.com/media/photo-s/08/d8/e9/5d/caption.jpg,"禁菸客房, 套房, 家庭房, 空調設施","免費停車, 免費高速上網 (WiFi), 免費網際網路, 無線網路, 餐廳, 提供早餐, 允許攜帶寵物 (可帶狗/寵物), 禁菸飯店, 公用無線網路, 網際網路",
嘉義優遊商旅,嘉義排名第 34 的超值住宿地點，共 122 家,https://www.tripadvisor.com.tw/Hotel_Review-g13806498-d2170713-Reviews-Chiayi_Yoyo_Hotel-East_District_Chiayi.html,23.48274040222168,120.46308135986328,NT$998,西區中山路617號11樓,3.0,嘉義,東區,"NT$1,163 - NT$2,734",3.5,41,https://media-cdn.tripadvisor.com/media/daodao/photo-s/01/fd/c1/9c/img-0497.jpg,"禁菸客房, 家庭房, 空調設施, 冰箱","免費停車, 免費高速上網 (WiFi), 免費網際網路, 無線網路, 公用無線網路, 網際網路, 餐廳, 禁菸飯店",
都市叢林汽車旅館,嘉義排名第 35 的超值住宿地點，共 122 家,https://www.tripadvisor.com.tw/Hotel_Review-g13808399-d2458436-Reviews-Jungle_City_Motel-West_District_Chiayi.html,23.48583984375,120.42733001708984,"NT$1,022",四維路269號,4.0,嘉義,西區,"NT$1,194 - NT$2,891",4.0,5,https://media-cdn.tripadvisor.com/media/photo-s/11/01/7f/e2/photo0jpg.jpg,"禁菸客房, 客房服務","無線網路, 公用無線網路, 網際網路, 禁菸飯店",
嘉義布袋光影民宿,嘉義排名第 36 的超值住宿地點，共 122 家,https://www.tripadvisor.com.tw/Hotel_Review-g297904-d12171581-Reviews-Light_Shadow_Budai_Chiayi-Chiayi.html,23.482759475708008,120.43364715576172,NT$842,布袋鎮新南路117號,3.0,嘉義,嘉義的特色住宿,"NT$597 - NT$2,231",4.5,3,https://media-cdn.tripadvisor.com/media/photo-s/10/ce/8b/4d/caption.jpg,"家庭房, 空調設施, 衣架, 浴缸/淋浴間, 免費衛浴用品, 吹風機","附近有免費公共停車場, 免費高速上網 (WiFi), 機場接送, 行李存放, 禁菸飯店, 快速辦理入住/退房, 私人辦理入住/退房, 洗衣服務, 路邊停車, 停車, 巴士接駁服務, 共用廚房, 共用休息室/電視區, 日光露台",
鼎川大飯店,嘉義排名第 37 的超值住宿地點，共 122 家,https://www.tripadvisor.com.tw/Hotel_Review-g13808399-d2458224-Reviews-River_Hotel-West_District_Chiayi.html,23.477602005004883,120.4422836303711,"NT$1,094",友愛路207號,3.0,嘉義,西區,"NT$1,163 - NT$2,922",3.5,8,https://media-cdn.tripadvisor.com/media/photo-s/0f/4e/64/28/2f.jpg,"禁菸客房, 家庭房, 空調設施, 客房服務, 冰箱","免費高速上網 (WiFi), 免費網際網路, 無線網路, 公用無線網路, 網際網路, 餐廳, 禮賓服務, 禁菸飯店",
國園商務大飯店,嘉義排名第 38 的超值住宿地點，共 122 家,https://www.tripadvisor.com.tw/Hotel_Review-g13808399-d1628325-Reviews-Country_Garden_Business_Hotel-West_District_Chiayi.html,23.47818946838379,120.44145965576172,"NT$1,181",光彩街678號,3.0,嘉義,西區,"NT$1,225 - NT$2,419",3.5,49,https://media-cdn.tripadvisor.com/media/photo-s/14/0f/08/d8/caption.jpg,"禁菸客房, 套房, 家庭房, 空調設施","免費高速上網 (WiFi), 免費網際網路, 無線網路, 公用無線網路, 免費早餐, 提供早餐, 禮賓服務, 禁菸飯店, 網際網路",
順億商務旅館,嘉義排名第 39 的超值住宿地點，共 122 家,https://www.tripadvisor.com.tw/Hotel_Review-g13808399-d6635828-Reviews-Shun_yi_Business_Hotel-West_District_Chiayi.html,23.469989776611328,120.41795349121094,"NT$1,038",中山路617號10樓,2.5,嘉義,西區,"NT$943 - NT$2,199",4.0,8,https://media-cdn.tripadvisor.com/media/photo-s/05/fa/76/6a/caption.jpg,,,
樂億皇家渡假酒店,嘉義排名第 40 的超值住宿地點，共 122 家,https://www.tripadvisor.com.tw/Hotel_Review-g13808399-d8419539-Reviews-Look_Royal_Resort-West_District_Chiayi.html,23.472888946533203,120.43055725097656,"NT$2,516",西區玉山路501號,3.5,嘉義,西區,"NT$2,168 - NT$3,519",3.5,32,https://media-cdn.tripadvisor.com/media/photo-s/09/fa/86/e0/caption.jpg,,免費網際網路,
玉山國際大飯店,嘉義排名第 41 的超值住宿地點，共 122 家,https://www.tripadvisor.com.tw/Hotel_Review-g13808399-d1841170-Reviews-E_Sun_Villa_Hotel-West_District_Chiayi.html,23.477890014648438,120.47650909423828,NT$859,玉山路65號,3.0,嘉義,西區,"NT$974 - NT$2,608",3.5,15,https://media-cdn.tripadvisor.com/media/daodao/photo-s/02/39/37/e1/caption.jpg,"空調設施, 客房服務, 冰箱","無線網路, 公用無線網路, 網際網路, 乾洗服務, 洗衣服務",NT$859
楓雅SPA 汽車旅館 (大雅館),嘉義排名第 42 的超值住宿地點，共 122 家,https://www.tripadvisor.com.tw/Hotel_Review-g13806498-d2084217-Reviews-Home_Yah_Spa_Motel-East_District_Chiayi.html,23.482749938964844,120.43121337890625,"NT$1,039",大雅路二段256號,3.5,嘉義,東區,"NT$1,194 - NT$1,697",4.0,1,https://media-cdn.tripadvisor.com/media/partner/bookingcom/photo-s/16/cc/d1/6d/propertybuilding.jpg,空調設施,餐廳,
